,Utterance,Speaker,Emotion,Dialogue_ID,Utterance_ID,Old_Dialogue_ID,Old_Utterance_ID,Season,Episode,StartTime,EndTime
513,"Well, I’m gonna go get these  in some water.",Ross,neutral,88,1,38,3,8,2,"0:20:32,522","0:20:34,983"
514,"No-no, I took them from the hotel lobby.",Ross,neutral,88,2,38,5,8,2,"00:20:37,611","00:20:41,989"
515,"Yeah, they think they can charge me for some dirty movie and a bag of Mashuga nuts, they got another think coming.",Ross,anger,88,3,38,6,8,2,"00:20:37,611","00:20:45,743"
516,Hey!,Ross,surprise,88,4,38,7,8,2,"0:20:49,081","0:20:49,582"
517,My sweater!,Ross,surprise,88,5,38,8,8,2,"0:20:49,582","0:20:51,192"
518,I’ve been looking for this for like a month!,Ross,surprise,88,6,38,9,8,2,"00:20:54,002","00:20:57,004"
519,"Well, I’m gonna go get these  in some water.",Ross,neutral,89,0,38,3,8,2,"0:20:32,522","0:20:34,983"
520,Wait you stole those from these people’s wedding?,Phoebe,surprise,89,1,38,4,8,2,"0:20:34,983","0:20:37,385"
521,"No-no, I took them from the hotel lobby.",Ross,neutral,89,2,38,5,8,2,"00:20:37,611","00:20:41,989"
522,"Yeah, they think they can charge me for some dirty movie and a bag of Mashuga nuts, they got another think coming.",Ross,anger,89,3,38,6,8,2,"00:20:37,611","00:20:45,743"
523,Hey!,Ross,surprise,89,4,38,7,8,2,"0:20:49,081","0:20:49,582"
524,My sweater!,Ross,surprise,89,5,38,8,8,2,"0:20:49,582","0:20:51,192"
525,I’ve been looking for this for like a month!,Ross,surprise,89,6,38,9,8,2,"00:20:54,002","00:20:57,004"
526,Oh my God!!,Phoebe,surprise,89,7,38,10,8,2,"00:21:01,843","00:21:03,719"
527,Oh my God!!,Phoebe,surprise,90,0,38,10,8,2,"00:21:01,843","00:21:03,719"
528,Oh my God!,Joey,surprise,90,1,38,11,8,2,"00:21:10,811","00:21:12,395"
529,Happy?! Is that what I’m supposed to be Vic? Happy?,Kate,anger,91,0,39,0,3,19,"00:11:00,868","00:11:03,912"
530,"Well, why don’t you tell me what you’re supposed to be!",Joey,anger,91,1,39,1,3,19,"0:11:05,623","0:11:07,515"
531,Huh?,Joey,surprise,91,2,39,2,3,19,"0:11:07,515","0:11:08,269"
532,Because I sure as hell can’t figure it out!,Joey,anger,91,3,39,3,3,19,"00:11:08,376","00:11:10,835"
533,I talk to you and nothin’.,Joey,anger,91,4,39,4,3,19,"00:11:11,003","00:11:13,421"
534,"You look at me, and it’s nothin’.",Joey,anger,91,5,39,5,3,19,"0:11:13,589","0:11:15,258"
535,Nothing.,Joey,anger,91,6,39,6,3,19,"0:11:15,258","0:11:16,114"
536,Yeah.,Joey,neutral,91,7,39,12,3,19,"00:11:42,535","00:11:43,743"
537,I think my character’s gonna need a little bit more of reason than that.,Kate,neutral,91,8,39,13,3,19,"00:11:43,911","00:11:46,955"
538,"Oh, hey, how about this one.",Joey,neutral,91,9,39,14,3,19,"00:11:47,123","00:11:50,375"
539,"Ah, it’s says so in the script!",Joey,anger,91,10,39,15,3,19,"00:11:47,123","00:11:59,467"
540,"Y'know ah, I-I don’t know why my character likes you either, I mean it says in the script here that you’re a bitch.",Joey,anger,91,11,39,16,3,19,"00:11:53,295","00:12:02,929"
541,It doesn’t say that in the script.,Kate,anger,91,12,39,17,3,19,"0:12:00,177","0:12:02,529"
542,It does in mine!,Joey,anger,91,13,39,18,3,19,"0:12:02,529","0:12:02,973"
543,"Well, why don’t you tell me what you’re supposed to be!",Joey,anger,92,0,39,1,3,19,"0:11:05,623","0:11:07,515"
544,Huh?,Joey,surprise,92,1,39,2,3,19,"0:11:07,515","0:11:08,269"
545,Because I sure as hell can’t figure it out!,Joey,anger,92,2,39,3,3,19,"00:11:08,376","00:11:10,835"
546,I talk to you and nothin’.,Joey,anger,92,3,39,4,3,19,"00:11:11,003","00:11:13,421"
547,"You look at me, and it’s nothin’.",Joey,anger,92,4,39,5,3,19,"0:11:13,589","0:11:15,258"
548,Nothing.,Joey,anger,92,5,39,6,3,19,"0:11:15,258","0:11:16,114"
549,"Tasty! I’m really starting to feel like you guys have a history, it’s-it’s nice.",The Director,joy,92,6,39,7,3,19,"00:11:23,057","00:11:30,021"
550,"Peel the onion. First of all, he’s good looking.",The Director,neutral,92,7,39,11,3,19,"00:11:37,279","00:11:43,743"
551,Yeah.,Joey,neutral,92,8,39,12,3,19,"00:11:42,535","00:11:43,743"
552,"Oh, hey, how about this one.",Joey,neutral,92,9,39,14,3,19,"00:11:47,123","00:11:50,375"
553,"Ah, it’s says so in the script!",Joey,anger,92,10,39,15,3,19,"00:11:47,123","00:11:59,467"
554,"Y'know ah, I-I don’t know why my character likes you either, I mean it says in the script here that you’re a bitch.",Joey,anger,92,11,39,16,3,19,"00:11:53,295","00:12:02,929"
555,"Tasty! I’m really starting to feel like you guys have a history, it’s-it’s nice.",The Director,joy,93,0,39,7,3,19,"00:11:23,057","00:11:30,021"
556,I have a question about this scene.,Kate,neutral,93,1,39,8,3,19,"0:11:30,189","0:11:31,941"
557,Yes?,The Director,neutral,93,2,39,9,3,19,"0:11:31,941","0:11:32,589"
558,"Well, I don’t understand why Adrienne’s attracted to Victor.",Kate,disgust,93,3,39,10,3,19,"00:11:32,692","00:11:37,112"
559,"Peel the onion. First of all, he’s good looking.",The Director,neutral,93,4,39,11,3,19,"00:11:37,279","00:11:43,743"
560,I can’t,Phoebe,anger,94,0,40,0,8,4,"00:04:36,859","00:04:40,237"
561,Yeah! You gotta tell a girl before you tape her. Such a rookie mistake.,Joey,anger,94,1,40,1,8,4,"00:04:40,405","00:04:43,532"
562,Yeah! You gotta tell a girl before you tape her. Such a rookie mistake.,Joey,anger,95,0,40,1,8,4,"00:04:40,405","00:04:43,532"
563,Y’know who has a great video camera?,Chandler,neutral,95,1,40,2,8,4,"0:04:47,996","0:04:50,008"
564,Let’s call ‘em.,Chandler,neutral,95,2,40,5,8,4,"0:04:54,879","0:04:55,020"
565,Yeah! Ask them if they brought their friends any souvenirs!,Joey,joy,95,3,40,6,8,4,"00:04:55,169","00:04:57,421"
566,Y’know who has a great video camera?,Chandler,neutral,96,0,40,2,8,4,"0:04:47,996","0:04:50,008"
567,Greg and Jenny?,Phoebe,neutral,96,1,40,3,8,4,"0:04:50,008","0:04:51,709"
568,Greg and Jenny?,Phoebe,neutral,97,0,40,3,8,4,"0:04:50,008","0:04:51,709"
569,Do you still wanna call ‘em? I wanna call ‘em.,Monica,neutral,97,1,40,4,8,4,"0:04:52,417","0:04:54,879"
570,Do you still wanna call ‘em? I wanna call ‘em.,Monica,neutral,98,0,40,4,8,4,"0:04:52,417","0:04:54,879"
571,Let’s call ‘em.,Chandler,neutral,98,1,40,5,8,4,"0:04:54,879","0:04:55,020"
572,"Uh sorry, wrong number.",Monica,fear,98,2,40,9,8,4,"0:05:10,977","0:05:12,187"
573,Here you go.,Chandler,neutral,98,3,40,10,8,4,"0:05:12,187","0:05:14,079"
574,Hello?   It’s the deli again!,Monica,surprise,98,4,40,11,8,4,"00:05:16,566","00:05:19,609"
575,Yeah! Ask them if they brought their friends any souvenirs!,Joey,joy,99,0,40,6,8,4,"00:04:55,169","00:04:57,421"
576,Hello?  Eighth street deli?,Monica,neutral,99,1,40,7,8,4,"00:05:04,095","00:05:06,471"
577,"Hey, hang up! You get food poisoning just talkin’ to that place.",Joey,disgust,99,2,40,8,8,4,"00:05:06,681","00:05:10,726"
578,"Uh sorry, wrong number.",Monica,fear,99,3,40,9,8,4,"0:05:10,977","0:05:12,187"
579,Hello?   It’s the deli again!,Monica,surprise,99,4,40,11,8,4,"00:05:16,566","00:05:19,609"
580,All right! I’ll have a sandwich!,Joey,joy,99,5,40,12,8,4,"00:05:19,777","00:05:21,945"
581,I don’t think this number’s right!,Monica,sadness,99,6,40,13,8,4,"00:05:22,864","00:05:24,448"
582,I don’t think this number’s right!,Monica,sadness,100,0,40,13,8,4,"00:05:22,864","00:05:24,448"
583,Oh come on!!,Rachel,sadness,100,1,40,14,8,4,"00:05:25,908","00:05:28,118"
584,"Gotta go. I miss you too, I love you, but it's getting real late now",Mr. Tribbiani,sadness,101,0,41,0,1,13,"00:04:41,281","00:04:49,162"
585,"Hey Ma. Listen, I made the appointment with Dr. Bazida, and... Excuse me?  Did you know this isn't Ma?",Joey,surprise,101,1,41,1,1,13,"00:04:45,493","00:04:56,503"
586,Her name's Ronni. She's a pet mortician.,Mr. Tribbiani,neutral,101,2,41,2,1,13,"00:05:05,680","00:05:09,891"
587,Sure. So how long you been...,Joey,neutral,101,3,41,3,1,13,"00:05:14,147","00:05:18,358"
588,"Remember when you were a little kid, I used to take you to the navy yard and show you the big ships?",Mr. Tribbiani,neutral,101,4,41,4,1,13,"00:05:20,486","00:05:28,994"
589,Since then?!,Joey,surprise,101,5,41,5,1,13,"0:05:25,158","0:05:26,076"
590,"No, it's only been six years.",Mr. Tribbiani,neutral,101,6,41,6,1,13,"0:05:26,076","0:05:29,058"
591,I just wanted to put a nice memory in your head so you'd know that I wasn't always such a terrible guy.,Mr. Tribbiani,neutral,101,7,41,7,1,13,"00:05:29,203","00:05:34,333"
592,...Joe.,Mr. Tribbiani,neutral,101,8,41,8,1,13,"0:05:37,003","0:05:37,462"
593,Y'ever been in love?,Mr. Tribbiani,neutral,101,9,41,9,1,13,"0:05:37,462","0:05:39,410"
594,...I d'know.,Joey,neutral,101,10,41,10,1,13,"00:05:41,049","00:05:42,090"
595,Then y'haven't. You're burning your tomatoes.,Mr. Tribbiani,neutral,101,11,41,11,1,13,"0:05:44,844","0:05:47,514"
596,You're one to talk.,Joey,disgust,101,12,41,12,1,13,"0:05:47,514","0:05:47,871"
597,"Joe, your dad's in love big time. And the worst part of it is, it's with two different women.",Mr. Tribbiani,neutral,101,13,41,13,1,13,"00:05:50,433","00:05:58,648"
598,Oh man. Please tell me one of 'em is Ma.,Joey,disgust,101,14,41,14,1,13,"00:05:55,605","00:05:58,648"
599,"Of course, course one of 'em's Ma. What's the matter with you.",Mr. Tribbiani,surprise,101,15,41,15,1,13,"00:05:58,900","00:06:01,818"
600,"Everything’s gonna be all right. Okay, Dick?",Chandler,neutral,102,0,42,0,3,23,"00:21:57,691","00:22:03,237"
601,"Hello, I am Guru Saj--Whoa!!  That’s supposed to be a duck right? ‘Cause otherwise, this is waaay out of my league.",Guru Saj,surprise,102,1,42,1,3,23,"00:22:05,907","00:22:13,456"
602,"Hey, Rach, how was work?",Monica,neutral,103,0,43,0,3,19,"00:21:33,917","00:21:37,211"
603,"Oh, great. Although I did sit down where there wasn’t a chair.",Rachel,neutral,103,1,43,1,3,19,"00:21:35,752","00:21:40,381"
604,"By the way, Ross dropped by a box of your stuff.",Monica,neutral,103,2,43,2,3,19,"00:21:41,258","00:21:43,718"
605,"Oh, well, I guess I had that one coming.",Rachel,neutral,103,3,43,3,3,19,"00:21:43,927","00:21:47,221"
606,"I’m just gonna throw it out, it’s probably just a bunch of shampoo and...",Rachel,neutral,103,4,43,4,3,19,"00:21:47,723","00:21:51,392"
607,Something wrong?,Monica,neutral,103,5,43,5,3,19,"00:21:52,936","00:21:54,145"
608,No. Nothing.,Rachel,neutral,103,6,43,6,3,19,"00:22:03,030","00:22:05,239"
609,"And then, and then you said that thing about, about bringing the Mesozoic era in the 21st century.",Charlie,neutral,104,0,44,0,9,23,"00:18:57,761","00:19:05,560"
610,"Yeah, that's it?",Ross,surprise,104,1,44,1,9,23,"0:19:03,767","0:19:04,989"
611,Yeah.,Charlie,neutral,104,2,44,2,9,23,"0:19:04,989","0:19:05,624"
612,"Dude, I am sorry about what I said!",Joey,sadness,105,0,45,0,4,18,"00:16:58,976","00:17:01,936"
613,"No, no, you’re right, it is a ridiculous name!",Chandler,disgust,105,1,45,1,4,18,"00:17:02,104","00:17:05,106"
614,It’s not that bad.,Joey,neutral,105,2,45,2,4,18,"00:17:05,983","00:17:08,609"
615,"Yes it is! From now on, I have no first name.",Chandler,anger,105,3,45,3,4,18,"00:17:09,361","00:17:12,321"
616,"So, you’re just Bing?",Joey,neutral,105,4,45,4,4,18,"00:17:13,198","00:17:16,451"
617,Because we won our apartment back!,Monica,joy,106,0,46,0,4,19,"00:12:41,177","00:12:42,927"
618,"What? Ace is high! Jack, queen, king, ace!",Joey,surprise,106,1,46,1,4,19,"00:12:43,095","00:12:46,264"
619,"No! Ace is low! Ace, two, three, four!",Monica,anger,106,2,46,2,4,19,"00:12:46,432","00:12:49,184"
620,"But, we pick again! We pick again!",Monica,joy,106,3,46,9,4,19,"00:13:27,223","00:13:28,932"
621,Why?!,Joey,neutral,106,4,46,10,4,19,"0:13:29,099","0:13:29,767"
622,I don’t know!,Monica,fear,106,5,46,11,4,19,"0:13:29,767","0:13:30,673"
623,"No! Ace is low! Ace, two, three, four!",Monica,anger,107,0,46,2,4,19,"00:12:46,432","00:12:49,184"
624,I don’t know. Ooh! Ooh! Look it!  Ah-ha!,Phoebe,surprise,107,1,46,3,4,19,"00:12:56,942","00:13:04,073"
625,I don’t know. Ooh! Ooh! Look it!  Ah-ha!,Phoebe,surprise,108,0,46,3,4,19,"00:12:56,942","00:13:04,073"
626,"All right, cut, let’s pick again, pick again.",Rachel,neutral,108,1,46,4,4,19,"0:13:06,577","0:13:08,259"
627,"All right, cut, let’s pick again, pick again.",Rachel,neutral,109,0,46,4,4,19,"0:13:06,577","0:13:08,259"
628,Okay.,Joey,neutral,109,1,46,5,4,19,"0:13:08,259","0:13:09,309"
629,Come on apartment! Come on apartment!  Oh! I know queen is high!,Rachel,anger,109,2,46,6,4,19,"00:13:11,332","00:13:19,589"
630,"Uh-huh, not as high as… It worked! King!",Joey,surprise,109,3,46,7,4,19,"00:13:19,757","00:13:23,802"
631,"Uh-huh, not as high as… It worked! King!",Joey,surprise,110,0,46,7,4,19,"00:13:19,757","00:13:23,802"
632,Yeah baby!,Chandler,joy,110,1,46,8,4,19,"00:13:23,969","00:13:26,596"
633,Tickets please!  That’s courtside baby!,Chandler,joy,110,2,46,12,4,19,"00:13:32,561","00:13:39,317"
634,"Seriously, good game though. Good game.   What are they so mad about? They get the apartment back!",Joey,surprise,110,3,46,13,4,19,"00:13:39,485","00:13:49,619"
635,No they didn’t!,Chandler,joy,110,4,46,14,4,19,"00:13:48,285","00:13:49,619"
636,Yeah baby!,Chandler,joy,111,0,46,8,4,19,"00:13:23,969","00:13:26,596"
637,"But, we pick again! We pick again!",Monica,joy,111,1,46,9,4,19,"00:13:27,223","00:13:28,932"
638,I don’t know!,Monica,fear,111,2,46,11,4,19,"0:13:29,767","0:13:30,673"
639,Tickets please!  That’s courtside baby!,Chandler,joy,111,3,46,12,4,19,"00:13:32,561","00:13:39,317"
640,"You know, I don't think we brought enough stuff. Did you forget to pack the baby's anvil?",Chandler,neutral,112,0,47,0,2,6,"00:06:09,327","00:06:13,747"
641,It's gonna be worth it.,Joey,neutral,112,1,47,1,2,6,"00:06:13,956","00:06:15,999"
642,"It's a known fact that women love babies, all right?",Joey,neutral,112,2,47,2,2,6,"00:06:16,167","00:06:19,252"
643,Women love guys who love babies.,Joey,neutral,112,3,47,3,2,6,"0:06:19,420","0:06:21,402"
644,It's that whole sensitive thing.,Joey,neutral,112,4,47,4,2,6,"0:06:21,402","0:06:22,984"
645,"Quick, aim him at that pack o' babes over there.",Joey,neutral,112,5,47,5,2,6,"0:06:23,758","0:06:25,730"
646,Maybe one of them will break away.,Joey,neutral,112,6,47,6,2,6,"0:06:25,730","0:06:27,684"
647,"No, no wait, for get them, we got one, hard left.",Joey,joy,112,7,47,7,2,6,"00:06:28,346","00:06:31,765"
648,"All right, gimme the baby.",Joey,neutral,112,8,47,8,2,6,"0:06:31,933","0:06:32,775"
649,"No, I got him.",Chandler,neutral,112,9,47,9,2,6,"0:06:32,775","0:06:33,769"
650,"Oh, seriously you want him?",Chandler,surprise,112,10,47,11,2,6,"00:06:35,353","00:06:37,229"
651,Hello.,Joey,neutral,112,11,47,12,2,6,"00:06:37,814","00:06:39,314"
652,"Well, don't, don't think me immodest, but, me?",Chandler,surprise,112,12,47,13,2,6,"00:06:43,820","00:06:48,281"
653,You wanna smell him?,Joey,neutral,112,13,47,14,2,6,"00:06:49,700","00:06:50,784"
654,"Oh, yeah. He's got that great baby smell. Get a whiff of his head.",Joey,joy,112,14,47,15,2,6,"00:06:55,832","00:06:59,126"
655,What'd I tell you? What'd I tell you?,Joey,joy,112,15,47,16,2,6,"00:07:04,298","00:07:05,674"
656,"Well, we are great guys.",Chandler,neutral,112,16,47,17,2,6,"00:07:07,552","00:07:09,928"
657,"Well, not really.",Ross,neutral,113,0,49,0,6,18,"00:12:56,692","00:12:57,859"
658,"I mean technically it’s-it’s not against the rules or anything, but it is frowned upon.",Ross,neutral,113,1,49,1,6,18,"00:12:58,027","00:13:02,197"
659,"Especially by that professor we ran into last night, Judgey von Holierthanthou.",Ross,anger,113,2,49,2,6,18,"00:13:02,364","00:13:06,951"
660,"Well Ross, you be careful now. You don’t want to get a reputation as y’know Professor McNailshisstudents.",Monica,joy,113,3,49,3,6,18,"00:13:10,039","00:13:15,001"
661,Yeah. What-what should I do?,Ross,fear,113,4,49,4,6,18,"0:13:17,963","0:13:19,590"
662,What?! You’re going out with her again!,Monica,surprise,113,5,49,15,6,18,"0:13:45,616","0:13:47,328"
663,Going out with who?,Ross,neutral,113,6,49,16,6,18,"0:13:47,328","0:13:47,537"
664,"Well, not really.",Ross,neutral,114,0,49,0,6,18,"00:12:56,692","00:12:57,859"
665,"I mean technically it’s-it’s not against the rules or anything, but it is frowned upon.",Ross,neutral,114,1,49,1,6,18,"00:12:58,027","00:13:02,197"
666,"Especially by that professor we ran into last night, Judgey von Holierthanthou.",Ross,anger,114,2,49,2,6,18,"00:13:02,364","00:13:06,951"
667,Yeah. What-what should I do?,Ross,fear,114,3,49,4,6,18,"0:13:17,963","0:13:19,590"
668,"Well Ross, it seems pretty clear.",Joey,neutral,114,4,49,5,6,18,"0:13:19,590","0:13:21,456"
669,I mean what’s more important?,Joey,neutral,114,5,49,6,6,18,"0:13:21,550","0:13:22,677"
670,"What people think or how you feel, huh?",Joey,neutral,114,6,49,7,6,18,"0:13:22,677","0:13:25,161"
671,"Ross, you gotta follow your heart.",Joey,neutral,114,7,49,8,6,18,"0:13:25,262","0:13:26,534"
672,"Well Ross, it seems pretty clear.",Joey,neutral,115,0,49,5,6,18,"0:13:19,590","0:13:21,456"
673,I mean what’s more important?,Joey,neutral,115,1,49,6,6,18,"0:13:21,550","0:13:22,677"
674,"What people think or how you feel, huh?",Joey,neutral,115,2,49,7,6,18,"0:13:22,677","0:13:25,161"
675,"Ross, you gotta follow your heart.",Joey,neutral,115,3,49,8,6,18,"0:13:25,262","0:13:26,534"
676,Joey that is so sweet.,Monica,joy,115,4,49,9,6,18,"0:13:26,534","0:13:28,570"
677,Joey! You didn’t even know her!,Monica,surprise,115,5,49,20,6,18,"0:14:01,799","0:14:03,061"
678,Ah whatever!,Joey,anger,115,6,49,21,6,18,"0:14:03,061","0:14:04,360"
679,Joey that is so sweet.,Monica,joy,116,0,49,9,6,18,"0:13:26,534","0:13:28,570"
680,Hey.,Chandler,neutral,116,1,49,10,6,18,"00:13:33,771","00:13:36,314"
681,"Hey, relax I just need more time. We’re going to dinner tonight.",Chandler,neutral,116,2,49,14,6,18,"00:13:42,988","00:13:45,448"
682,What?! You’re going out with her again!,Monica,surprise,116,3,49,15,6,18,"0:13:45,616","0:13:47,328"
683,"No, that was Dana Caplin.",Chandler,neutral,116,4,49,19,6,18,"00:13:56,919","00:13:58,461"
684,Joey! You didn’t even know her!,Monica,surprise,116,5,49,20,6,18,"0:14:01,799","0:14:03,061"
685,"Well Ross, it seems pretty clear.",Joey,neutral,117,0,49,5,6,18,"0:13:19,590","0:13:21,456"
686,I mean what’s more important?,Joey,neutral,117,1,49,6,6,18,"0:13:21,550","0:13:22,677"
687,"What people think or how you feel, huh?",Joey,neutral,117,2,49,7,6,18,"0:13:22,677","0:13:25,161"
688,"Ross, you gotta follow your heart.",Joey,neutral,117,3,49,8,6,18,"0:13:25,262","0:13:26,534"
689,Hey.,Chandler,neutral,117,4,49,10,6,18,"00:13:33,771","00:13:36,314"
690,"Hey-hey-hey! So, how did it go with Dana? Any reason I should leave a block of time open say Thursday?",Joey,neutral,117,5,49,11,6,18,"00:13:36,482","00:13:40,235"
691,I couldn’t do it.,Chandler,sadness,117,6,49,12,6,18,"0:13:40,402","0:13:41,464"
692,You couldn’t do it?!,Joey,surprise,117,7,49,13,6,18,"0:13:41,464","0:13:42,878"
693,"Hey, relax I just need more time. We’re going to dinner tonight.",Chandler,neutral,117,8,49,14,6,18,"00:13:42,988","00:13:45,448"
694,"Well, not really.",Ross,neutral,118,0,49,0,6,18,"00:12:56,692","00:12:57,859"
695,"I mean technically it’s-it’s not against the rules or anything, but it is frowned upon.",Ross,neutral,118,1,49,1,6,18,"00:12:58,027","00:13:02,197"
696,"Especially by that professor we ran into last night, Judgey von Holierthanthou.",Ross,anger,118,2,49,2,6,18,"00:13:02,364","00:13:06,951"
697,Going out with who?,Ross,neutral,118,3,49,16,6,18,"0:13:47,328","0:13:47,537"
698,"Uh, Dana Keystone from college.",Chandler,neutral,118,4,49,17,6,18,"00:13:49,328","00:13:52,413"
699,Oh yeah! Wasn’t she uh,Ross,surprise,118,5,49,18,6,18,"00:13:52,581","00:13:55,708"
700,"No, that was Dana Caplin.",Chandler,neutral,118,6,49,19,6,18,"00:13:56,919","00:13:58,461"
701,"Morning! Hey, how’s my favorite genius and my little robot buddy?!",Joey,joy,119,0,50,0,6,21,"00:14:11,308","00:14:15,436"
702,Don’t touch him!,Wayne,anger,119,1,50,1,6,21,"0:14:15,604","0:14:18,816"
703,Okay!,Joey,surprise,119,2,50,2,6,21,"0:14:18,816","0:14:19,128"
704,All right.,Joey,neutral,119,3,50,3,6,21,"0:14:19,128","0:14:19,414"
705,"Umm, all right Wayne, level with me.",Joey,neutral,119,4,50,4,6,21,"00:14:19,859","00:14:24,279"
706,I-I keep hearing all these rumors that I might get fired.,Joey,fear,119,5,50,5,6,21,"00:14:19,859","00:14:24,279"
707,"Okay, they even have actors coming in to read for my part!",Joey,fear,119,6,50,6,6,21,"00:14:24,446","00:14:27,657"
708,"Come on man, you-you got to give me a second chance!",Joey,sadness,119,7,50,7,6,21,"00:14:27,825","00:14:30,326"
709,"I mean, I love-I love this little guy!",Joey,joy,119,8,50,8,6,21,"0:14:30,494","0:14:31,956"
710,Ah-ah!!,Joey,surprise,119,9,50,9,6,21,"0:14:31,956","0:14:33,140"
711,"Okay, that’s why you didn’t want me to touch him right?",Joey,surprise,119,10,50,10,6,21,"0:14:33,706","0:14:36,292"
712,Here you go!,Joey,neutral,119,11,50,11,6,21,"0:14:36,292","0:14:36,714"
713,Okay?,Joey,neutral,119,12,50,12,6,21,"0:14:36,714","0:14:37,872"
714,Stupid!,Joey,anger,119,13,50,13,6,21,"0:14:39,795","0:14:41,881"
715,I can’t believe it!,Joey,surprise,119,14,50,14,6,21,"0:14:41,881","0:14:42,215"
716,God!,Joey,anger,119,15,50,15,6,21,"0:14:42,215","0:14:42,929"
717,"Hey, how you doin’?",Joey,neutral,119,16,50,16,6,21,"00:14:44,550","00:14:47,010"
718,Hey.,Ross,neutral,120,0,51,0,3,15,"00:11:10,086","00:11:12,629"
719,"Hi. Look um, about what happened earlier...",Rachel,sadness,120,1,51,1,3,15,"00:11:10,086","00:11:14,839"
720,"No, hey, well, I-I completely understand. You were, you were stressed.",Ross,neutral,120,2,51,2,3,15,"00:11:15,007","00:11:18,927"
721,I was gonna give you a chance to apologise to me.,Rachel,disgust,120,3,51,3,3,15,"00:11:22,431","00:11:25,433"
722,For what? For letting you throw me out of your office?,Ross,anger,120,4,51,4,3,15,"00:11:26,018","00:11:28,645"
723,You had no,Rachel,anger,120,5,51,5,3,15,"00:11:28,938","00:11:31,981"
724,"Yeah, well excuse me for wanting to be with my girlfriend on our anniversary, boy what an ass am I.",Ross,anger,120,6,51,6,3,15,"00:11:40,616","00:11:45,745"
725,"But I told you, I didn’t have the time!",Rachel,anger,120,7,51,7,3,15,"00:11:47,206","00:11:49,958"
726,"Yeah, well you never have the time. I mean, I don’t feel like I even have a girlfriend anymore, Rachel.",Ross,anger,120,8,51,8,3,15,"00:11:50,126","00:11:54,587"
727,"Wh, Ross what do you want from me?",Rachel,anger,120,9,51,9,3,15,"00:11:54,755","00:11:56,423"
728,"You want me, you want me to quit my job so you can feel like you have a girlfriend?",Rachel,anger,120,10,51,10,3,15,"00:11:56,590","00:11:59,467"
729,I know.,Monica,neutral,121,0,52,0,3,21,"00:12:55,000","00:12:56,232"
730,"Ooh, I have to tell you something.",Phoebe,joy,121,1,52,1,3,21,"00:12:56,400","00:12:57,942"
731,What?,Monica,neutral,121,2,52,2,3,21,"0:12:58,360","0:12:58,992"
732,But I can’t tell you.,Phoebe,neutral,121,3,52,3,3,21,"0:12:58,992","0:13:00,878"
733,"Okay, but wouldn’t it be easier if you had to tell me something that you could tell me.",Monica,neutral,121,4,52,4,3,21,"00:13:02,490","00:13:13,917"
734,"Well, sure in a perfect world. But, no, I promised I wouldn’t tell, and I swore to like all my gods.",Phoebe,neutral,121,5,52,5,3,21,"00:13:06,202","00:13:13,917"
735,Okay. Does it have to do with Ross and Rachel?,Monica,neutral,121,6,52,6,3,21,"00:13:15,544","00:13:18,922"
736,No.,Phoebe,neutral,121,7,52,7,3,21,"00:13:19,089","00:13:20,256"
737,Does it have to do with Joey?,Monica,neutral,121,8,52,8,3,21,"0:13:20,424","0:13:21,676"
741,Hi!,Richard,joy,122,0,53,0,6,24,"00:20:42,741","00:20:45,159"
742,Richard!,Monica,joy,122,1,53,1,6,24,"00:20:45,911","00:20:47,161"
747,"Well, it was great seeing you the other night.",Richard,joy,122,6,53,6,6,24,"00:20:58,674","00:21:01,384"
749,No! I came here to tell you something else.  I came here  to tell you I still love you.,Richard,joy,122,8,53,8,6,24,"00:21:06,932","00:21:15,481"
750,"One pregnant woman at a time, please! I just want you to be okay.",Joey,disgust,123,0,54,0,8,10,"00:19:18,574","00:19:27,123"
751,So forcing her to marry Bobby is gonna make that happen?,Rachel,sadness,123,1,54,1,8,10,"00:19:27,291","00:19:29,876"
752,"Maybe!  Well! Well…so-so uh, what kind of music does Numb Nuts—Oh forget it! I can’t!",Joey,anger,123,2,54,2,8,10,"00:19:30,043","00:19:40,803"
754,Come here!,Joey,joy,123,4,54,22,8,10,"0:21:03,179","0:21:04,950"
755,No! Seriously! What’s wrong with you?!,Rachel,anger,123,5,54,23,8,10,"00:21:12,396","00:21:15,106"
756,"Maybe!  Well! Well…so-so uh, what kind of music does Numb Nuts—Oh forget it! I can’t!",Joey,anger,124,0,54,2,8,10,"00:19:30,043","00:19:40,803"
757,"Joey, I am scared to death about this.",Dina,fear,124,1,54,3,8,10,"00:19:40,971","00:19:43,764"
758,"But I really think I can do it, I’m just gonna need some help.",Dina,fear,124,2,54,4,8,10,"00:19:43,932","00:19:46,642"
760,"Look, Rachel’s told me how much easier you’ve made all this on her. Why can’t you do that for me?",Dina,anger,124,4,54,7,8,10,"00:19:59,698","00:20:07,445"
761,Because! ‘Cause… ‘Cause you’re my baby sister!,Joey,sadness,124,5,54,8,8,10,"00:20:07,623","00:20:09,582"
762,And you’re my big brother!,Dina,joy,124,6,54,9,8,10,"00:20:09,750","00:20:11,250"
765,I was scared of telling you.,Dina,fear,124,9,54,12,8,10,"0:20:17,174","0:20:20,476"
766,"Well I’d be scared of them, but all right.",Joey,fear,124,10,54,13,8,10,"00:20:21,261","00:20:24,138"
767,"Joey, I can’t stand the thought of having this baby with you mad at me.",Dina,sadness,124,11,54,14,8,10,"00:20:24,306","00:20:28,809"
768,I want him to have his uncle.,Dina,sadness,124,12,54,15,8,10,"00:20:28,977","00:20:31,938"
769,Is my baby gonna have his Uncle Joey?,Dina,sadness,124,13,54,16,8,10,"00:20:32,105","00:20:34,523"
770,Of course he’s gonna have his Uncle Joey!,Joey,joy,124,14,54,17,8,10,"00:20:36,860","00:20:40,655"
